{
  "capability": "immunization_history",
  "adapter_version": "0.1.0",
  "description": "Doses dos imunobiológicos pedidos (MIV), com dose, estratégia e registro anterior. registration_date é o dia do registro no PEC (difere da aplicação na transcrição tardia).",
  "record_kind": "immunization",
  "entity_type_column": "source_entity_type",
  "record_id_column": "source_record_id",
  "municipality_column": "municipality_ibge",
  "scope_date_column": "application_date",
  "query": "queries/immunization_history@0.1.0.sql",
  "binds": [
    {
      "name": "municipality_ibge",
      "type": "MUNICIPALITY_IBGE"
    },
    {
      "name": "period_start",
      "type": "PERIOD_START"
    },
    {
      "name": "period_end_exclusive",
      "type": "PERIOD_END_EXCLUSIVE"
    },
    {
      "name": "birth_date_from",
      "type": "DATE"
    },
    {
      "name": "birth_date_to",
      "type": "DATE"
    },
    {
      "name": "immunobiological_codes",
      "type": "TEXT_ARRAY"
    }
  ],
  "columns": [
    {
      "name": "source_entity_type",
      "type": "text",
      "required": true
    },
    {
      "name": "source_record_id",
      "type": "text",
      "required": true
    },
    {
      "name": "municipality_ibge",
      "type": "text",
      "required": true
    },
    {
      "name": "person_key",
      "type": "text",
      "required": true
    },
    {
      "name": "application_date",
      "type": "date",
      "required": true
    },
    {
      "name": "immunobiological_code",
      "type": "text",
      "required": true
    },
    {
      "name": "dose_code",
      "type": "text",
      "required": false
    },
    {
      "name": "strategy_code",
      "type": "text",
      "required": false
    },
    {
      "name": "transcription",
      "type": "bool",
      "required": false
    },
    {
      "name": "cbo",
      "type": "text",
      "required": false
    },
    {
      "name": "cnes",
      "type": "text",
      "required": false
    },
    {
      "name": "ine",
      "type": "text",
      "required": false
    },
    {
      "name": "registration_date",
      "type": "date",
      "required": false
    }
  ]
}
