{
  "capability": "home_visit",
  "adapter_version": "0.1.0",
  "description": "Visitas domiciliares e territoriais (MIVDT) no período: CBO, desfecho, motivos, peso e altura.",
  "record_kind": "home_visit",
  "entity_type_column": "source_entity_type",
  "record_id_column": "source_record_id",
  "municipality_column": "municipality_ibge",
  "scope_date_column": "visit_date",
  "query": "queries/home_visit@0.1.0.sql",
  "binds": [
    {
      "name": "municipality_ibge",
      "type": "MUNICIPALITY_IBGE"
    },
    {
      "name": "period_start",
      "type": "PERIOD_START"
    },
    {
      "name": "period_end_exclusive",
      "type": "PERIOD_END_EXCLUSIVE"
    },
    {
      "name": "birth_date_from",
      "type": "DATE"
    },
    {
      "name": "birth_date_to",
      "type": "DATE"
    }
  ],
  "columns": [
    {
      "name": "source_entity_type",
      "type": "text",
      "required": true
    },
    {
      "name": "source_record_id",
      "type": "text",
      "required": true
    },
    {
      "name": "municipality_ibge",
      "type": "text",
      "required": true
    },
    {
      "name": "person_key",
      "type": "text",
      "required": true
    },
    {
      "name": "visit_date",
      "type": "date",
      "required": true
    },
    {
      "name": "cbo",
      "type": "text",
      "required": false
    },
    {
      "name": "cnes",
      "type": "text",
      "required": false
    },
    {
      "name": "ine",
      "type": "text",
      "required": false
    },
    {
      "name": "outcome_code",
      "type": "text",
      "required": false
    },
    {
      "name": "reason_codes",
      "type": "text[]",
      "required": false
    },
    {
      "name": "weight_kg",
      "type": "decimal",
      "required": false
    },
    {
      "name": "height_cm",
      "type": "decimal",
      "required": false
    }
  ]
}
