{
  "capability": "condition_list",
  "adapter_version": "0.1.0",
  "description": "Condições avaliadas ou autorreferidas com os códigos CIAP-2/CID-10 pedidos, com situação (ativa/resolvida) (§1.7 Condição).",
  "record_kind": "condition",
  "entity_type_column": "source_entity_type",
  "record_id_column": "source_record_id",
  "municipality_column": "municipality_ibge",
  "scope_date_column": "recorded_date",
  "query": "queries/condition_list@0.1.0.sql",
  "binds": [
    {
      "name": "municipality_ibge",
      "type": "MUNICIPALITY_IBGE"
    },
    {
      "name": "period_start",
      "type": "PERIOD_START"
    },
    {
      "name": "period_end_exclusive",
      "type": "PERIOD_END_EXCLUSIVE"
    },
    {
      "name": "birth_date_from",
      "type": "DATE"
    },
    {
      "name": "birth_date_to",
      "type": "DATE"
    },
    {
      "name": "ciap_codes",
      "type": "TEXT_ARRAY"
    },
    {
      "name": "cid_codes",
      "type": "TEXT_ARRAY"
    }
  ],
  "columns": [
    {
      "name": "source_entity_type",
      "type": "text",
      "required": true
    },
    {
      "name": "source_record_id",
      "type": "text",
      "required": true
    },
    {
      "name": "municipality_ibge",
      "type": "text",
      "required": true
    },
    {
      "name": "person_key",
      "type": "text",
      "required": true
    },
    {
      "name": "code_system",
      "type": "text",
      "required": true
    },
    {
      "name": "code",
      "type": "text",
      "required": true
    },
    {
      "name": "recorded_date",
      "type": "date",
      "required": true
    },
    {
      "name": "status",
      "type": "text",
      "required": false
    },
    {
      "name": "resolved_date",
      "type": "date",
      "required": false
    },
    {
      "name": "basis",
      "type": "text",
      "required": true
    }
  ]
}
